,date_beach_address,height_low_tide_max,height_low_tide_min,height_low_tide_mean,date,beach_address,beach_name,country_state,country,latitude,longitude
424,2020-04-27|Lachan Island Mercury Passage Tasmania AUSTRALIA,-0.058912222604167695,-0.4301456377750833,-0.2445289301896255,2020-04-27,Lachan Island Mercury Passage Tasmania AUSTRALIA,Lachan Island,Tasmania,AUSTRALIA,-42.642743599999996,147.97761830000002
425,2020-04-27|Lady Beach at Warrnambool Victoria AUSTRALIA,-0.08653604348918714,-0.4583358353611332,-0.2724359394251602,2020-04-27,Lady Beach at Warrnambool Victoria AUSTRALIA,Lady Beach at Warrnambool,Victoria,AUSTRALIA,-38.3974833,142.4726155
426,2020-04-27|Lady Julia Percy Island Victoria AUSTRALIA,-0.08511120003844903,-0.44396335393864567,-0.26453727698854734,2020-04-27,Lady Julia Percy Island Victoria AUSTRALIA,Lady Julia Percy Island,Victoria,AUSTRALIA,-38.4160708,142.00376599999998
427,2020-04-27|Lady Martin’s Beach Sydney Harbor New South Wales AUSTRALIA,-0.3729549192866717,-0.5287400255451896,-0.45084747241593065,2020-04-27,Lady Martin’s Beach Sydney Harbor New South Wales AUSTRALIA,Lady Martin’s Beach,New South Wales,AUSTRALIA,-33.865044299999994,151.2534844
428,2020-04-27|Lake Conjola near Milton New South Wales AUSTRALIA,-0.3337830018994365,-0.5246054798654024,-0.4291942408824194,2020-04-27,Lake Conjola near Milton New South Wales AUSTRALIA,Lake Conjola,New South Wales,AUSTRALIA,-35.2696191,150.4810158
429,2020-04-27|Lake Illawarra New South Wales AUSTRALIA,-0.3579286812491558,-0.5278899312260451,-0.44290930623760044,2020-04-27,Lake Illawarra New South Wales AUSTRALIA,Lake Illawarra,New South Wales,AUSTRALIA,-34.541667,150.85833300000002
430,2020-04-27|Lake Macquarie New South Wales AUSTRALIA,-0.39416556215587206,-0.5335171177582698,-0.46384133995707094,2020-04-27,Lake Macquarie New South Wales AUSTRALIA,Lake Macquarie,New South Wales,AUSTRALIA,-33.031122499999995,151.56032439999998
431,2020-04-27|Lamberts Beach Mackay Queensland AUSTRALIA,-1.2893234063382013,-1.3421369228084954,-1.3157301645733483,2020-04-27,Lamberts Beach Mackay Queensland AUSTRALIA,Lambert's Beach,Queensland,AUSTRALIA,-21.074391600000002,149.22827949999999
432,2020-04-27|Lambert’s Beach Mackay Queensland AUSTRALIA,-1.2893234063382013,-1.3421369228084954,-1.3157301645733483,2020-04-27,Lambert’s Beach Mackay Queensland AUSTRALIA,Lambert’s Beach,Queensland,AUSTRALIA,-21.074391600000002,149.22827949999999
433,2020-04-27|Lambeth Street Wharf New South Wales AUSTRALIA,-0.36681437756575125,-0.5276338359352999,-0.4472241067505256,2020-04-27,Lambeth Street Wharf New South Wales AUSTRALIA,Lambeth Street Wharf,New South Wales,AUSTRALIA,-33.9633441,150.99770900000001
434,2020-04-27|Lamont Reef Queensland AUSTRALIA,-0.6339719428853587,-0.7864118408285324,-0.7101918918569456,2020-04-27,Lamont Reef Queensland AUSTRALIA,Lamont Reef,Queensland,AUSTRALIA,-23.6013947,152.0308565
435,2020-04-27|Lancelin Island Western Australia AUSTRALIA,-0.21000979813102122,-0.21000979813102122,-0.21000979813102122,2020-04-27,Lancelin Island Western Australia AUSTRALIA,Lancelin Island,Western Australia,AUSTRALIA,-31.007032899999995,115.3167243
436,2020-04-27|Lancelin Western Australia AUSTRALIA,-0.21000979813102122,-0.21000979813102122,-0.21000979813102122,2020-04-27,Lancelin Western Australia AUSTRALIA,Lancelin,Western Australia,AUSTRALIA,-31.045409799999998,115.35327749999999
437,2020-04-27|Lane Cove River Sydney Harbor Estuary New South Wales AUSTRALIA,-0.3745259928563172,-0.528720405804526,-0.4516231993304216,2020-04-27,Lane Cove River Sydney Harbor Estuary New South Wales AUSTRALIA,Lane Cove River,New South Wales,AUSTRALIA,-33.7827054,151.14003469999997
438,2020-04-27|Lane Cove River Sydney Harbor New South Wales AUSTRALIA,-0.3745259928563172,-0.528720405804526,-0.4516231993304216,2020-04-27,Lane Cove River Sydney Harbor New South Wales AUSTRALIA,Lane Cove River,New South Wales,AUSTRALIA,-33.7827054,151.14003469999997
439,2020-04-27|Largs Bay South Australia AUSTRALIA,-0.9272375405280245,-1.1482973591812673,-1.0377674498546459,2020-04-27,Largs Bay South Australia AUSTRALIA,Largs Bay,South Australia,AUSTRALIA,-34.821,138.494
440,2020-04-27|Latitude Reef near Forster New South Wales AUSTRALIA,-0.42861360349674865,-0.5264674627604272,-0.4775405331285879,2020-04-27,Latitude Reef near Forster New South Wales AUSTRALIA,Latitude Reef,New South Wales,AUSTRALIA,-32.180556,152.511667
441,2020-04-27|Laura Bay South Australia AUSTRALIA,-0.43923363139554017,-0.690229192060351,-0.5647314117279456,2020-04-27,Laura Bay South Australia AUSTRALIA,Laura Bay,South Australia,AUSTRALIA,-32.2280904,133.83199679999998
442,2020-04-27|Left break at the ‘Hot Spot’ at Sheringa Beach Western Australia AUSTRALIA,-0.2988275339352582,-0.5263328227673928,-0.4125801783513255,2020-04-27,Left break at the ‘Hot Spot’ at Sheringa Beach Western Australia AUSTRALIA,Left break at the ‘Hot Spot’ at Sheringa Beach,Western Australia,AUSTRALIA,-33.891765299999996,135.18893730000002
443,2020-04-27|Lefthanders Beach Margaret River Western Australia AUSTRALIA,-0.22553927512639882,-0.22553927512639882,-0.22553927512639882,2020-04-27,Lefthanders Beach Margaret River Western Australia AUSTRALIA,Lefthanders Beach,Western Australia,AUSTRALIA,-33.8752851,114.98611319999999
444,2020-04-27|Lefthanders Margaret River Area Western Australia AUSTRALIA,-0.22553927512639882,-0.22553927512639882,-0.22553927512639882,2020-04-27,Lefthanders Margaret River Area Western Australia AUSTRALIA,Lefthanders,Western Australia,AUSTRALIA,-33.8752851,114.98611319999999
445,2020-04-27|Leichardt Sydney New South Wales AUSTRALIA,-0.3729549192866717,-0.5287400255451896,-0.45084747241593065,2020-04-27,Leichardt Sydney New South Wales AUSTRALIA,Leichardt,New South Wales,AUSTRALIA,-33.8837222,151.157028
446,2020-04-27|Leighton Beach North Fremantle Western Australia AUSTRALIA,-0.12004774836491151,-0.20274365239802422,-0.16139570038146786,2020-04-27,Leighton Beach North Fremantle Western Australia AUSTRALIA,Leighton Beach,Western Australia,AUSTRALIA,-32.028432,115.7503284
447,2020-04-27|Leighton Beach north of Freemantle Western Australia AUSTRALIA,-0.12004774836491151,-0.20274365239802422,-0.16139570038146786,2020-04-27,Leighton Beach north of Freemantle Western Australia AUSTRALIA,Leighton Beach,Western Australia,AUSTRALIA,-32.024505600000005,115.7503081
448,2020-04-27|Leighton Beach south of North Cottesloe Western Australia AUSTRALIA,-0.12004774836491151,-0.20274365239802422,-0.16139570038146786,2020-04-27,Leighton Beach south of North Cottesloe Western Australia AUSTRALIA,Leighton Beach,Western Australia,AUSTRALIA,-32.028432,115.7503284
449,2020-04-27|Lennox Head Ballina New South Wales AUSTRALIA,-0.4818878317892514,-0.5004812000574348,-0.4911845159233431,2020-04-27,Lennox Head Ballina New South Wales AUSTRALIA,Lennox Head,New South Wales,AUSTRALIA,-28.8,153.583333
450,2020-04-27|Lennox Head New South Wales AUSTRALIA,-0.4818878317892514,-0.5004812000574348,-0.4911845159233431,2020-04-27,Lennox Head New South Wales AUSTRALIA,Lennox Head,New South Wales,AUSTRALIA,-28.8,153.583333
451,2020-04-27|Lennox Heads New South Wales AUSTRALIA,-0.4818878317892514,-0.5004812000574348,-0.4911845159233431,2020-04-27,Lennox Heads New South Wales AUSTRALIA,Lennox Heads,New South Wales,AUSTRALIA,-28.8,153.583333
452,2020-04-27|Levys Beach Victoria AUSTRALIA,-0.055423424292433104,-0.3909954054318373,-0.2232094148621352,2020-04-27,Levys Beach Victoria AUSTRALIA,Levys Beach,Victoria,AUSTRALIA,-37.471307700000004,144.7851531
453,2020-04-27|Lighthouse Beach Ballina New South Wales AUSTRALIA,-0.4836918088730291,-0.49948840516067555,-0.49159010701685235,2020-04-27,Lighthouse Beach Ballina New South Wales AUSTRALIA,Lighthouse Beach,New South Wales,AUSTRALIA,-28.8725999,153.58992469999998
454,2020-04-27|Lighthouse Beach New South Wales AUSTRALIA,-0.4473995498314624,-0.514644861444891,-0.48102220563817666,2020-04-27,Lighthouse Beach New South Wales AUSTRALIA,Lighthouse Beach,New South Wales,AUSTRALIA,-31.4789172,152.9298045
455,2020-04-27|Lighthouse Beach Seal Rocks New South Wales AUSTRALIA,-0.4136537090411691,-0.5282318438849134,-0.4709427764630413,2020-04-27,Lighthouse Beach Seal Rocks New South Wales AUSTRALIA,Lighthouse Beach,New South Wales,AUSTRALIA,-32.4436471,152.52793569999997
456,2020-04-27|Line Reef Queensland AUSTRALIA,-0.30400448616953707,-0.6567582780305017,-0.48038138210001935,2020-04-27,Line Reef Queensland AUSTRALIA,Line Reef,Queensland,AUSTRALIA,-19.674144000000002,149.1746224
457,2020-04-27|Line Reef northeast of Hamilton Island Whitsundays Queensland AUSTRALIA,-0.30400448616953707,-0.6567582780305017,-0.48038138210001935,2020-04-27,Line Reef northeast of Hamilton Island Whitsundays Queensland AUSTRALIA,Line Reef,Queensland,AUSTRALIA,-19.674144000000002,149.1746224
458,2020-04-27|Lipson Cove Tumby Bay South Australia AUSTRALIA,-0.45695650699824736,-0.5179977342566363,-0.48747712062744186,2020-04-27,Lipson Cove Tumby Bay South Australia AUSTRALIA,Lipson Cove,South Australia,AUSTRALIA,-34.2592315,136.2625804
459,2020-04-27|Lismore New South Wales AUSTRALIA,-0.4907496326263319,-0.49510352714117867,-0.4929265798837553,2020-04-27,Lismore New South Wales AUSTRALIA,Lismore,New South Wales,AUSTRALIA,-28.8093154,153.2882876
460,2020-04-27|Little Beach Reef Bremer Bay Western Australia AUSTRALIA,-0.1729916433294902,-0.19511158549616892,-0.18405161441282958,2020-04-27,Little Beach Reef Bremer Bay Western Australia AUSTRALIA,Little Beach Reef,Western Australia,AUSTRALIA,-34.4650904,119.0936263
461,2020-04-27|Little Congwong Beach La Perouse New South Wales AUSTRALIA,-0.368483528458599,-0.5279373769827301,-0.44821045272066456,2020-04-27,Little Congwong Beach La Perouse New South Wales AUSTRALIA,Little Congwong Beach,New South Wales,AUSTRALIA,-33.9915566,151.2383626
462,2020-04-27|Little Island near Hillarys Western Australia AUSTRALIA,-0.11632277116583968,-0.20465278308031862,-0.16048777712307916,2020-04-27,Little Island near Hillarys Western Australia AUSTRALIA,Little Island,Western Australia,AUSTRALIA,-31.8123368,115.70911540000002
463,2020-04-27|Lizard Island Queensland AUSTRALIA,-0.028309901945163567,-0.5449756446187168,-0.2866427732819402,2020-04-27,Lizard Island Queensland AUSTRALIA,Lizard Island,Queensland,AUSTRALIA,-14.668043300000003,145.463777
464,2020-04-27|Logan River Queensland AUSTRALIA,-0.46464630572542254,-0.5132611244853685,-0.48895371510539554,2020-04-27,Logan River Queensland AUSTRALIA,Logan River,Queensland,AUSTRALIA,-28.073537800000004,152.924704
465,2020-04-27|Long Reef Collaroy New South Wales AUSTRALIA,-0.37662375704668993,-0.5298149158569381,-0.453219336451814,2020-04-27,Long Reef Collaroy New South Wales AUSTRALIA,Long Reef,New South Wales,AUSTRALIA,-33.741958399999994,151.31703280000002
466,2020-04-27|Long Reef North Manly New South Wales AUSTRALIA,-0.37662375704668993,-0.5298149158569381,-0.453219336451814,2020-04-27,Long Reef North Manly New South Wales AUSTRALIA,Long Reef,New South Wales,AUSTRALIA,-33.7419539,151.3170694
467,2020-04-27|Long Reef north of Sydney New South Wales AUSTRALIA,-0.3745259928563172,-0.528720405804526,-0.4516231993304216,2020-04-27,Long Reef north of Sydney New South Wales AUSTRALIA,Long Reef,New South Wales,AUSTRALIA,-33.746083399999996,151.30407160000001
468,2020-04-27|Lookout Point Queensland AUSTRALIA,-0.43670446178896133,-0.528947676708748,-0.48282606924885463,2020-04-27,Lookout Point Queensland AUSTRALIA,Lookout Point,Queensland,AUSTRALIA,-27.434650800000004,153.5304523
469,2020-04-27|Lord Howe Island New South Wales AUSTRALIA,-0.5591200459531844,-0.5630235637193671,-0.5610718048362757,2020-04-27,Lord Howe Island New South Wales AUSTRALIA,Lord Howe Island,New South Wales,AUSTRALIA,-31.555326300000004,159.0821211
470,2020-04-27|Lord Howe Island island group 440 miles northeast of Sydney New South Wales AUSTRALIA,-0.5591200459531844,-0.5630235637193671,-0.5610718048362757,2020-04-27,Lord Howe Island island group 440 miles northeast of Sydney New South Wales AUSTRALIA,Lord Howe Island (island group 440 miles northeast of Sydney),New South Wales,AUSTRALIA,-31.555326300000004,159.0821211
471,2020-04-27|Lorne Victoria AUSTRALIA,-0.5411967047043647,-0.9916940495027609,-0.7664453771035628,2020-04-27,Lorne Victoria AUSTRALIA,Lorne,Victoria,AUSTRALIA,-38.5366556,143.97154840000002
472,2020-04-27|Maatsuyker Island Tasmania AUSTRALIA,0.09426980289770567,-0.36532466752018433,-0.13552743231123932,2020-04-27,Maatsuyker Island Tasmania AUSTRALIA,Maatsuyker Island,Tasmania,AUSTRALIA,-43.6522707,146.27698130000002
473,2020-04-27|Mackay Queensland AUSTRALIA,-1.3405142857925576,-1.3830026245664835,-1.3617584551795205,2020-04-27,Mackay Queensland AUSTRALIA,Mackay,Queensland,AUSTRALIA,-21.1424956,149.1821469
474,2020-04-27|Macleay River New South Wales AUSTRALIA,-0.46265914832739585,-0.5066638707809774,-0.48466150955418663,2020-04-27,Macleay River New South Wales AUSTRALIA,Macleay River,New South Wales,AUSTRALIA,-30.8273843,152.45621
475,2020-04-27|Magnetic Island Queensland AUSTRALIA,-0.1586745664308017,-0.6849165374143737,-0.4217955519225877,2020-04-27,Magnetic Island Queensland AUSTRALIA,Magnetic Island,Queensland,AUSTRALIA,-19.135865300000003,146.8423556
476,2020-04-27|Magra Islet Queensland AUSTRALIA,-0.21865756113597298,-0.6946475899377682,-0.4566525755368706,2020-04-27,Magra Islet Queensland AUSTRALIA,Magra Islet,Queensland,AUSTRALIA,-11.8573472,143.2815326
477,2020-04-27|Main Beach Gold Coast Queensland AUSTRALIA,-0.46065853688769565,-0.5155718127154074,-0.48811517480155153,2020-04-27,Main Beach Gold Coast Queensland AUSTRALIA,Main Beach,Queensland,AUSTRALIA,-27.963,153.42600000000002
478,2020-04-27|Main Beach Southport Queensland AUSTRALIA,-0.46065853688769565,-0.5155718127154074,-0.48811517480155153,2020-04-27,Main Beach Southport Queensland AUSTRALIA,Main Beach,Queensland,AUSTRALIA,-27.963,153.42600000000002
479,2020-04-27|Malagil Barrier Reef Queensland AUSTRALIA,-0.1415723730520954,-0.6721806283201659,-0.4068765006861307,2020-04-27,Malagil Barrier Reef Queensland AUSTRALIA,Malagil,Queensland,AUSTRALIA,-19.3594967,146.885081
480,2020-04-27|Manley Beach New South Wales AUSTRALIA,-0.3745259928563172,-0.528720405804526,-0.4516231993304216,2020-04-27,Manley Beach New South Wales AUSTRALIA,Manley Beach,New South Wales,AUSTRALIA,-33.7931501,151.2876488
481,2020-04-27|Manly Marineland Sydney New South Wales AUSTRALIA,-0.3745259928563172,-0.528720405804526,-0.4516231993304216,2020-04-27,Manly Marineland Sydney New South Wales AUSTRALIA,Manly Marineland,New South Wales,AUSTRALIA,-33.8060158,151.29477749999998
482,2020-04-27|Manly New South Wales AUSTRALIA,-0.3745259928563172,-0.528720405804526,-0.4516231993304216,2020-04-27,Manly New South Wales AUSTRALIA,Manly,New South Wales,AUSTRALIA,-33.8060158,151.29477749999998
483,2020-04-27|Manning River New South Wales AUSTRALIA,-0.4300319931200997,-0.5262793179067046,-0.4781556555134021,2020-04-27,Manning River New South Wales AUSTRALIA,Manning River,New South Wales,AUSTRALIA,-31.8518472,152.10067469999998
484,2020-04-27|Maria River New South Wales AUSTRALIA,-0.45437603178924324,-0.5100210297634401,-0.48219853077634167,2020-04-27,Maria River New South Wales AUSTRALIA,Maria River,New South Wales,AUSTRALIA,-31.269947600000002,152.8567516
485,2020-04-27|Marineland Aquarium Manley Sydney New South Wales AUSTRALIA,-0.3745259928563172,-0.528720405804526,-0.4516231993304216,2020-04-27,Marineland Aquarium Manley Sydney New South Wales AUSTRALIA,Marineland Aquarium,New South Wales,AUSTRALIA,-33.795355,151.285014
486,2020-04-27|Marineland Sydney New South Wales AUSTRALIA,-0.3729549192866717,-0.5287400255451896,-0.45084747241593065,2020-04-27,Marineland Sydney New South Wales AUSTRALIA,Marineland,New South Wales,AUSTRALIA,-33.8695997,151.2021381
487,2020-04-27|Marino South Australia AUSTRALIA,-0.8216478815419594,-1.0294055684798038,-0.9255267250108816,2020-04-27,Marino South Australia AUSTRALIA,Marino,South Australia,AUSTRALIA,-35.049724499999996,138.5162223
488,2020-04-27|Marion Bay South Australia AUSTRALIA,-0.19872195425595077,-0.3918622329513781,-0.29529209360366443,2020-04-27,Marion Bay South Australia AUSTRALIA,Marion Bay,South Australia,AUSTRALIA,-35.2398829,136.97959939999998
489,2020-04-27|Mark’s Point Swan Bay Lake Macquarie New South Wales AUSTRALIA,-0.39416556215587206,-0.5335171177582698,-0.46384133995707094,2020-04-27,Mark’s Point Swan Bay Lake Macquarie New South Wales AUSTRALIA,Mark’s Point,New South Wales,AUSTRALIA,-33.0589864,151.64430869999998
490,2020-04-27|Maroochydore Beach Queensland AUSTRALIA,-0.44205138214044337,-0.5530159056621018,-0.4975336439012726,2020-04-27,Maroochydore Beach Queensland AUSTRALIA,Maroochydore Beach,Queensland,AUSTRALIA,-26.65447,153.10362869999997
491,2020-04-27|Maroochydore Queensland AUSTRALIA,-0.44205138214044337,-0.5530159056621018,-0.4975336439012726,2020-04-27,Maroochydore Queensland AUSTRALIA,Maroochydore,Queensland,AUSTRALIA,-26.65,153.1
492,2020-04-27|Maroubra Bay New South Wales AUSTRALIA,-0.37087085184044366,-0.5281484319835971,-0.44950964191202036,2020-04-27,Maroubra Bay New South Wales AUSTRALIA,Maroubra Bay,New South Wales,AUSTRALIA,-33.980540000000005,151.24301
493,2020-04-27|Maroubra Beach New South Wales AUSTRALIA,-0.37185744246110114,-0.5284128995537478,-0.4501351710074245,2020-04-27,Maroubra Beach New South Wales AUSTRALIA,Maroubra Beach,New South Wales,AUSTRALIA,-33.9495,151.2437
494,2020-04-27|Maroubra New South Wales AUSTRALIA,-0.37185744246110114,-0.5284128995537478,-0.4501351710074245,2020-04-27,Maroubra New South Wales AUSTRALIA,Maroubra,New South Wales,AUSTRALIA,-33.9495,151.2437
495,2020-04-27|Martin Islet New South Wales AUSTRALIA,-0.3591118546030816,-0.5277911148523438,-0.4434514847277127,2020-04-27,Martin Islet New South Wales AUSTRALIA,Martin Islet,New South Wales,AUSTRALIA,-34.4943401,150.93782480000002
496,2020-04-27|Mary River Queensland AUSTRALIA,-0.4376388735157219,-0.5554308224158134,-0.49653484796576763,2020-04-27,Mary River Queensland AUSTRALIA,Mary River,Queensland,AUSTRALIA,-26.184755499999998,152.64317409999998
497,2020-04-27|Maryborough Queensland AUSTRALIA,-0.8314864941591824,-0.9534815074601343,-0.8924840008096584,2020-04-27,Maryborough Queensland AUSTRALIA,Maryborough,Queensland,AUSTRALIA,-25.523262699999997,152.6970636
498,2020-04-27|Mauds Point Western Australia AUSTRALIA,-0.11847753356002051,-0.20362994408238652,-0.16105373882120352,2020-04-27,Mauds Point Western Australia AUSTRALIA,Mauds Point,Western Australia,AUSTRALIA,-31.954288399999996,115.8624252
499,2020-04-27|McKenzies Beach New South Wales AUSTRALIA,-0.32438570750807383,-0.5249064981185064,-0.4246461028132901,2020-04-27,McKenzies Beach New South Wales AUSTRALIA,McKenzies Beach,New South Wales,AUSTRALIA,-35.8043718,150.226363
500,2020-04-27|McMasters Beach Central Coast New South Wales AUSTRALIA,-0.38017599307865524,-0.5313866461172794,-0.4557813195979673,2020-04-27,McMasters Beach Central Coast New South Wales AUSTRALIA,McMasters Beach,New South Wales,AUSTRALIA,-33.4967169,151.4114482
501,2020-04-27|Melbourne Victoria AUSTRALIA,-0.05599107678193013,-0.3929429686686161,-0.22446702272527314,2020-04-27,Melbourne Victoria AUSTRALIA,Melbourne,Victoria,AUSTRALIA,-37.813627600000004,144.96305759999998
502,2020-04-27|Mereweather Beach New South Wales AUSTRALIA,-0.39898988621779424,-0.5341853773299828,-0.4665876317738885,2020-04-27,Mereweather Beach New South Wales AUSTRALIA,Mereweather Beach,New South Wales,AUSTRALIA,-32.9465493,151.7599466
503,2020-04-27|Merewether Beach Newcastle New South Wales AUSTRALIA,-0.39898988621779424,-0.5341853773299828,-0.4665876317738885,2020-04-27,Merewether Beach Newcastle New South Wales AUSTRALIA,Merewether Beach,New South Wales,AUSTRALIA,-32.9465493,151.7599466
504,2020-04-27|Merewether Beach near Newcastle New South Wales AUSTRALIA,-0.39898988621779424,-0.5341853773299828,-0.4665876317738885,2020-04-27,Merewether Beach near Newcastle New South Wales AUSTRALIA,Merewether Beach,New South Wales,AUSTRALIA,-32.9465493,151.7599466
505,2020-04-27|Merimbula New South Wales AUSTRALIA,-0.3061722444430132,-0.514939088764315,-0.41055566660366416,2020-04-27,Merimbula New South Wales AUSTRALIA,Merimbula,New South Wales,AUSTRALIA,-36.8875485,149.90587480000002
506,2020-04-27|Merino Rocks Adelaide South Australia AUSTRALIA,-0.8216478815419594,-1.0294055684798038,-0.9255267250108816,2020-04-27,Merino Rocks Adelaide South Australia AUSTRALIA,Merino Rocks,South Australia,AUSTRALIA,-35.05,138.5166667
507,2020-04-27|Mermaid Beach Queensland AUSTRALIA,-0.46464630572542254,-0.5132611244853685,-0.48895371510539554,2020-04-27,Mermaid Beach Queensland AUSTRALIA,Mermaid Beach,Queensland,AUSTRALIA,-28.044,153.437
508,2020-04-27|Mermaid Waters Queensland AUSTRALIA,-0.46464630572542254,-0.5132611244853685,-0.48895371510539554,2020-04-27,Mermaid Waters Queensland AUSTRALIA,Mermaid Waters,Queensland,AUSTRALIA,-28.047778000000005,153.42166699999999
509,2020-04-27|Metro coast Western Australia AUSTRALIA,-0.11613582566406466,-0.20501137990904159,-0.16057360278655314,2020-04-27,Metro coast Western Australia AUSTRALIA,Metro coast,Western Australia,AUSTRALIA,-31.7478596,115.7726817
510,2020-04-27|Miall Island Queensland AUSTRALIA,-1.3061907387898943,-1.311149243688709,-1.3086699912393018,2020-04-27,Miall Island Queensland AUSTRALIA,Miall Island,Queensland,AUSTRALIA,-23.1528552,150.9052831
511,2020-04-27|Miami Lake Queensland AUSTRALIA,-0.46464630572542254,-0.5132611244853685,-0.48895371510539554,2020-04-27,Miami Lake Queensland AUSTRALIA,Miami Lake,Queensland,AUSTRALIA,-28.076944399999995,153.4366667
512,2020-04-27|Middle Beach 40 km north of Adelaide South Australia AUSTRALIA,-0.9921320573471493,-1.220944273235977,-1.1065381652915631,2020-04-27,Middle Beach 40 km north of Adelaide South Australia AUSTRALIA,Middle Beach,South Australia,AUSTRALIA,-34.5795185,138.4821124
513,2020-04-27|Middle Brighton Port Phillip Victoria AUSTRALIA,-0.05599107678193013,-0.3929429686686161,-0.22446702272527314,2020-04-27,Middle Brighton Port Phillip Victoria AUSTRALIA,Middle Brighton,Victoria,AUSTRALIA,-37.915053799999995,144.9962287
514,2020-04-27|Middle Harbour Sugarloaf Bay Sydney Estuary New South Wales AUSTRALIA,-0.3745259928563172,-0.528720405804526,-0.4516231993304216,2020-04-27,Middle Harbour Sugarloaf Bay Sydney Estuary New South Wales AUSTRALIA,Middle Harbour,New South Wales,AUSTRALIA,-33.7831723,151.2231308
515,2020-04-27|Middle Harbour Sydney New South Wales AUSTRALIA,-0.3745259928563172,-0.528720405804526,-0.4516231993304216,2020-04-27,Middle Harbour Sydney New South Wales AUSTRALIA,Middle Harbour,New South Wales,AUSTRALIA,-33.7859956,151.2260866
516,2020-04-27|Middleton Beach South Australia AUSTRALIA,-0.1194054640013962,-0.44177558347418666,-0.2805905237377914,2020-04-27,Middleton Beach South Australia AUSTRALIA,Middleton Beach,South Australia,AUSTRALIA,-35.51150689999999,138.7185508
517,2020-04-27|Middleton Point Fleurieu Peninsula South Australia AUSTRALIA,-0.1194054640013962,-0.44177558347418666,-0.2805905237377914,2020-04-27,Middleton Point Fleurieu Peninsula South Australia AUSTRALIA,Middleton Point,South Australia,AUSTRALIA,-35.5142799,138.70844
518,2020-04-27|Middleton Reef Queensland AUSTRALIA,-1.0759973623947465,-1.0759973623947465,-1.0759973623947465,2020-04-27,Middleton Reef Queensland AUSTRALIA,Middleton Reef,Queensland,AUSTRALIA,-22.3581165,141.54921140000002
519,2020-04-27|Millers Point New South Wales AUSTRALIA,-0.3729549192866717,-0.5287400255451896,-0.45084747241593065,2020-04-27,Millers Point New South Wales AUSTRALIA,Millers Point,New South Wales,AUSTRALIA,-33.86085,151.20281
520,2020-04-27|Millicent South Australia AUSTRALIA,-0.1099438330618725,-0.4231199878169757,-0.2665319104394241,2020-04-27,Millicent South Australia AUSTRALIA,Millicent,South Australia,AUSTRALIA,-37.6050244,140.3593062
521,2020-04-27|Mindarie Western Australia AUSTRALIA,-0.1158134381421452,-0.20588729428003938,-0.16085036621109228,2020-04-27,Mindarie Western Australia AUSTRALIA,Mindarie,Western Australia,AUSTRALIA,-31.6900771,115.7060487
522,2020-04-27|Moama Beach South Australia AUSTRALIA,-0.055423424292433104,-0.3909954054318373,-0.2232094148621352,2020-04-27,Moama Beach South Australia AUSTRALIA,Moama Beach,South Australia,AUSTRALIA,-36.1214284,144.7528293
523,2020-04-27|Moffat Beach Caloundra Queensland AUSTRALIA,-0.4476592640265638,-0.5570391125003615,-0.5023491882634626,2020-04-27,Moffat Beach Caloundra Queensland AUSTRALIA,Moffat Beach,Queensland,AUSTRALIA,-26.791,153.139
524,2020-04-27|Mollymook Beach Bannister Head New South Wales AUSTRALIA,-0.33233961797860284,-0.5243615436217088,-0.42835058080015587,2020-04-27,Mollymook Beach Bannister Head New South Wales AUSTRALIA,Mollymook Beach,New South Wales,AUSTRALIA,-35.32012279999999,150.47556730000002
525,2020-04-27|Mona Vale Beach Sydney New South Wales AUSTRALIA,-0.3770065753247504,-0.530575189230976,-0.45379088227786324,2020-04-27,Mona Vale Beach Sydney New South Wales AUSTRALIA,Mona Vale Beach,New South Wales,AUSTRALIA,-33.6795811,151.31354850000002
526,2020-04-27|Mona Vale New South Wales AUSTRALIA,-0.3770065753247504,-0.530575189230976,-0.45379088227786324,2020-04-27,Mona Vale New South Wales AUSTRALIA,Mona Vale,New South Wales,AUSTRALIA,-33.675959999999996,151.30653
527,2020-04-27|Mona Vale near Sydney New South Wales AUSTRALIA,-0.3770065753247504,-0.530575189230976,-0.45379088227786324,2020-04-27,Mona Vale near Sydney New South Wales AUSTRALIA,Mona Vale,New South Wales,AUSTRALIA,-33.675959999999996,151.30653
528,2020-04-27|Moodie Beach New South Wales AUSTRALIA,-0.47270534572997,-0.5067585720003043,-0.4897319588651371,2020-04-27,Moodie Beach New South Wales AUSTRALIA,Moodie Beach,New South Wales,AUSTRALIA,-30.210286,153.15729
