,date_beach_address,height_low_tide_max,height_low_tide_min,height_low_tide_mean,date,beach_address,beach_name,country_state,country,latitude,longitude
0,2020-04-27|1 km off Blacks Beach Queensland AUSTRALIA,-1.2863811577732718,-1.3360446277054874,-1.3112128927393796,2020-04-27,1 km off Blacks Beach Queensland AUSTRALIA,1 km off Black's Beach,Queensland,AUSTRALIA,-21.062778,149.1875
1,2020-04-27|10 miles off Nambucca Heads onboard trawler New South Wales AUSTRALIA,-0.46582764454171693,-0.5064858808523705,-0.48615676269704367,2020-04-27,10 miles off Nambucca Heads onboard trawler New South Wales AUSTRALIA,10 miles off Nambucca Heads onboard trawler,New South Wales,AUSTRALIA,-30.6419702,152.9978834
2,2020-04-27|15 km north of Lancelin north of Perth Western Australia AUSTRALIA,-0.21000979813102122,-0.21000979813102122,-0.21000979813102122,2020-04-27,15 km north of Lancelin north of Perth Western Australia AUSTRALIA,15 km north of Lancelin,Western Australia,AUSTRALIA,-31.045409799999998,115.35327749999999
3,2020-04-27|15 miles off shore New South Wales AUSTRALIA,-0.37775956393728005,-0.5311679566788544,-0.45446376030806723,2020-04-27,15 miles off shore New South Wales AUSTRALIA,1.5 miles off shore,New South Wales,AUSTRALIA,-31.2532183,146.921099
4,2020-04-27|15 miles up the Cataract River New South Wales AUSTRALIA,-0.36161958215172624,-0.5276915951725227,-0.4446555886621245,2020-04-27,15 miles up the Cataract River New South Wales AUSTRALIA,15 miles up the Cataract River,New South Wales,AUSTRALIA,-34.229766399999995,150.7616844
5,2020-04-27|150 yards from the pier at Lorne Victoria AUSTRALIA,-0.5411967047043647,-0.9916940495027609,-0.7664453771035628,2020-04-27,150 yards from the pier at Lorne Victoria AUSTRALIA,150 yards from the pier at Lorne,Victoria,AUSTRALIA,-38.5366556,143.97154840000002
6,2020-04-27|18 km west of Bunbury Western Australia AUSTRALIA,-0.1305664232737852,-0.2304169746413153,-0.18049169895755024,2020-04-27,18 km west of Bunbury Western Australia AUSTRALIA,18 km west of Bunbury,Western Australia,AUSTRALIA,-33.3209971,115.63834820000001
7,2020-04-27|18 miles south of Port Augusta South Australia AUSTRALIA,-0.7322238098996007,-1.4245764133694783,-1.0784001116345394,2020-04-27,18 miles south of Port Augusta South Australia AUSTRALIA,18 miles south of Port Augusta,South Australia,AUSTRALIA,-32.495233899999995,137.78943940000002
8,2020-04-27|20 k off The Spit off the Gold Coast Queensland AUSTRALIA,-0.46065853688769565,-0.5155718127154074,-0.48811517480155153,2020-04-27,20 k off The Spit off the Gold Coast Queensland AUSTRALIA,20 k off The Spit,Queensland,AUSTRALIA,-27.9352516,153.43347680000002
9,2020-04-27|20 miles off Sydney New South Wales AUSTRALIA,-0.3729549192866717,-0.5287400255451896,-0.45084747241593065,2020-04-27,20 miles off Sydney New South Wales AUSTRALIA,20 miles off Sydney,New South Wales,AUSTRALIA,-33.8688197,151.2092955
10,2020-04-27|200 km east of Coolangatta Queensland AUSTRALIA,-0.46777007377317753,-0.510006431290932,-0.4888882525320548,2020-04-27,200 km east of Coolangatta Queensland AUSTRALIA,200 km east of Coolangatta,Queensland,AUSTRALIA,-28.166666999999997,153.533333
11,2020-04-27|200 miles offshore Queensland AUSTRALIA,-1.0335381465370435,-1.0335381465370435,-1.0335381465370435,2020-04-27,200 miles offshore Queensland AUSTRALIA,200 miles offshore,Queensland,AUSTRALIA,-20.9175738,142.7027956
12,2020-04-27|26 nautical miles out to sea off Lake Macquarie New South Wales AUSTRALIA,-0.4473995498314624,-0.514644861444891,-0.48102220563817666,2020-04-27,26 nautical miles out to sea off Lake Macquarie New South Wales AUSTRALIA,26 nautical miles out to sea off Lake Macquarie,New South Wales,AUSTRALIA,-31.433333,152.9
13,2020-04-27|3 km off Port Victoria Yorke Peninsula South Australia AUSTRALIA,-0.43888124378545645,-0.43888124378545645,-0.43888124378545645,2020-04-27,3 km off Port Victoria Yorke Peninsula South Australia AUSTRALIA,3 km off Port Victoria,South Australia,AUSTRALIA,-34.496666999999995,137.48333300000002
14,2020-04-27|3 km west of Rottnest Island Western Australia AUSTRALIA,-0.20342640804870776,-0.20342640804870776,-0.20342640804870776,2020-04-27,3 km west of Rottnest Island Western Australia AUSTRALIA,3 km west of Rottnest Island,Western Australia,AUSTRALIA,-32.0063677,115.5073002
15,2020-04-27|3 miles out to sea off Glenelg South Australia AUSTRALIA,-0.8216478815419594,-1.0294055684798038,-0.9255267250108816,2020-04-27,3 miles out to sea off Glenelg South Australia AUSTRALIA,3 miles out to sea off Glenelg,South Australia,AUSTRALIA,-34.982,138.516
16,2020-04-27|5 miles south of Sussex Inlet at mouth of Berara Lake New South Wales AUSTRALIA,-0.3337830018994365,-0.5246054798654024,-0.4291942408824194,2020-04-27,5 miles south of Sussex Inlet at mouth of Berara Lake New South Wales AUSTRALIA,5 miles south of Sussex Inlet at mouth of Berara Lake,New South Wales,AUSTRALIA,-35.206926200000005,150.5515985
17,2020-04-27|5 nm off Cervantes Western Australia AUSTRALIA,-1.0827667168252997,-2.1818824131654573,-1.6323245649953786,2020-04-27,5 nm off Cervantes Western Australia AUSTRALIA,5 nm off Cervantes,Western Australia,AUSTRALIA,34.5199402,-105.87009009999998
18,2020-04-27|50 km east of Townsville Queensland AUSTRALIA,-0.1396391170338417,-0.6702045445780532,-0.40492183080594746,2020-04-27,50 km east of Townsville Queensland AUSTRALIA,50 km east of Townsville,Queensland,AUSTRALIA,-19.2589635,146.8169483
19,2020-04-27|55 miles south of Adelaide South Australia AUSTRALIA,-0.8216478815419594,-1.0294055684798038,-0.9255267250108816,2020-04-27,55 miles south of Adelaide South Australia AUSTRALIA,55 miles south of Adelaide,South Australia,AUSTRALIA,-34.9284989,138.6007456
20,2020-04-27|6 km off Collendina south of Melbourne Victoria AUSTRALIA,-0.05599107678193013,-0.3929429686686161,-0.22446702272527314,2020-04-27,6 km off Collendina south of Melbourne Victoria AUSTRALIA,6 km off Collendina,Victoria,AUSTRALIA,-37.835,144.96
21,2020-04-27|7 Mile Beach Gerroa New South Wales AUSTRALIA,-0.35296669287230753,-0.5281508768056099,-0.4405587848389587,2020-04-27,7 Mile Beach Gerroa New South Wales AUSTRALIA,7 Mile Beach,New South Wales,AUSTRALIA,-34.7699,150.813133
22,2020-04-27|7 km off Trigg surf beach Perth Western Australia AUSTRALIA,-0.11757071972446338,-0.20425225353274457,-0.16091148662860397,2020-04-27,7 km off Trigg surf beach Perth Western Australia AUSTRALIA,7 km off Trigg surf beach,Western Australia,AUSTRALIA,-31.8744999,115.7531233
23,2020-04-27|A pearl farm in Roebuck Bay Western Australia AUSTRALIA,-3.325809506256736,-3.6301638999625423,-3.4779867031096394,2020-04-27,A pearl farm in Roebuck Bay Western Australia AUSTRALIA,A pearl farm in Roebuck Bay,Western Australia,AUSTRALIA,-18.0858333,122.28305559999998
24,2020-04-27|Adelaide South Australia AUSTRALIA,-0.8216478815419594,-1.0294055684798038,-0.9255267250108816,2020-04-27,Adelaide South Australia AUSTRALIA,Adelaide,South Australia,AUSTRALIA,-34.9284989,138.6007456
25,2020-04-27|African Reef off Geraldton Western Australia AUSTRALIA,-0.07272133331825455,-0.25092684265435805,-0.1476836513807866,2020-04-27,African Reef off Geraldton Western Australia AUSTRALIA,African Reef off Geraldton,Western Australia,AUSTRALIA,-28.802443,114.61852209999999
26,2020-04-27|Albany Western Australia AUSTRALIA,-0.175302767664588,-0.1765019922949707,-0.17590237997977937,2020-04-27,Albany Western Australia AUSTRALIA,Albany,Western Australia,AUSTRALIA,-35.0269344,117.8837206
27,2020-04-27|Albany incident took place 200 metres from swimmers Western Australia AUSTRALIA,-0.175302767664588,-0.1765019922949707,-0.17590237997977937,2020-04-27,Albany incident took place 200 metres from swimmers Western Australia AUSTRALIA,Albany (incident took place 200 metres from swimmers),Western Australia,AUSTRALIA,-35.0269344,117.8837206
28,2020-04-27|Albert Park in Port Phillip Bay Victoria AUSTRALIA,-0.05599107678193013,-0.3929429686686161,-0.22446702272527314,2020-04-27,Albert Park in Port Phillip Bay Victoria AUSTRALIA,Albert Park in Port Phillip Bay,Victoria,AUSTRALIA,-37.8438609,144.95145359999998
29,2020-04-27|Aldinga Beach South Australia AUSTRALIA,-0.7199753523663059,-0.9131484976300756,-0.8165619249981908,2020-04-27,Aldinga Beach South Australia AUSTRALIA,Aldinga Beach,South Australia,AUSTRALIA,-35.281,138.454
30,2020-04-27|Alexandra Headland near Mooloolaba Queensland AUSTRALIA,-0.44282933020200904,-0.5530600928839352,-0.49794471154297215,2020-04-27,Alexandra Headland near Mooloolaba Queensland AUSTRALIA,Alexandra Headland near Mooloolaba,Queensland,AUSTRALIA,-26.673000000000002,153.101
31,2020-04-27|Alma Bay Magnetic Island Townsville Queensland AUSTRALIA,-0.1503624883399585,-0.6767712629966759,-0.4135668756683172,2020-04-27,Alma Bay Magnetic Island Townsville Queensland AUSTRALIA,Alma Bay,Queensland,AUSTRALIA,-19.148322,146.868517
32,2020-04-27|Altona Melbourne Victoria AUSTRALIA,-0.055423424292433104,-0.3909954054318373,-0.2232094148621352,2020-04-27,Altona Melbourne Victoria AUSTRALIA,Altona,Victoria,AUSTRALIA,-37.863151200000004,144.81202180000002
33,2020-04-27|Amity Point North Stradbroke Island Queensland AUSTRALIA,-0.7017411007584918,-0.786035331188991,-0.7438882159737414,2020-04-27,Amity Point North Stradbroke Island Queensland AUSTRALIA,Amity Point,Queensland,AUSTRALIA,-27.397250800000002,153.45375990000002
34,2020-04-27|Anglesea Victoria AUSTRALIA,-0.5825427364744199,-1.0420855883198523,-0.8123141623971362,2020-04-27,Anglesea Victoria AUSTRALIA,Anglesea,Victoria,AUSTRALIA,-38.4096639,144.18251709999998
35,2020-04-27|Angourie New South Wales AUSTRALIA,-0.48424069586124835,-0.5058308405636394,-0.4950357682124439,2020-04-27,Angourie New South Wales AUSTRALIA,Angourie,New South Wales,AUSTRALIA,-29.479166999999997,153.359444
36,2020-04-27|Angourie near Yamba New South Wales AUSTRALIA,-0.48424069586124835,-0.5058308405636394,-0.4950357682124439,2020-04-27,Angourie near Yamba New South Wales AUSTRALIA,Angourie,New South Wales,AUSTRALIA,-29.479166999999997,153.359444
37,2020-04-27|Arakoons Little Bay New South Wales AUSTRALIA,-0.37087085184044366,-0.5281484319835971,-0.44950964191202036,2020-04-27,Arakoons Little Bay New South Wales AUSTRALIA,Arakoon's Little Bay,New South Wales,AUSTRALIA,-33.980540000000005,151.24301
38,2020-04-27|Archies Beach Queensland AUSTRALIA,-1.0335381465370435,-1.0335381465370435,-1.0335381465370435,2020-04-27,Archies Beach Queensland AUSTRALIA,Archie's Beach,Queensland,AUSTRALIA,-20.9175738,142.7027956
39,2020-04-27|Ardrossan South Australia AUSTRALIA,-1.0927146221198785,-1.0927146221198785,-1.0927146221198785,2020-04-27,Ardrossan South Australia AUSTRALIA,Ardrossan,South Australia,AUSTRALIA,-34.419107399999994,137.91780119999999
40,2020-04-27|Arlington Reef near Cairns Queensland AUSTRALIA,-0.03621279475598244,-0.5729538230596863,-0.3045833089078344,2020-04-27,Arlington Reef near Cairns Queensland AUSTRALIA,Arlington Reef near Cairns,Queensland,AUSTRALIA,-16.688272899999998,146.0357725
41,2020-04-27|Arrawarra Headland New South Wales AUSTRALIA,-0.47487318685514607,-0.5058137719076956,-0.49034347938142087,2020-04-27,Arrawarra Headland New South Wales AUSTRALIA,Arrawarra Headland,New South Wales,AUSTRALIA,-30.068610999999997,153.195278
42,2020-04-27|At Flat Top near Mackay Queensland AUSTRALIA,-1.382470655110588,-1.42298815909624,-1.402729407103414,2020-04-27,At Flat Top near Mackay Queensland AUSTRALIA,At Flat Top,Queensland,AUSTRALIA,-21.162427899999997,149.24560830000001
43,2020-04-27|Auckland Creek Gladstone Queensland AUSTRALIA,-0.8627838099324384,-0.9708660522987035,-0.916824931115571,2020-04-27,Auckland Creek Gladstone Queensland AUSTRALIA,Auckland Creek,Queensland,AUSTRALIA,-23.875737899999997,151.24061310000002
44,2020-04-27|Austinmer New South Wales AUSTRALIA,-0.3629517186116104,-0.5275927710097832,-0.4452722448106968,2020-04-27,Austinmer New South Wales AUSTRALIA,Austinmer,New South Wales,AUSTRALIA,-34.306311,150.93451000000002
45,2020-04-27|Avalon Beach New South Wales AUSTRALIA,-0.37775956393728005,-0.5311679566788544,-0.45446376030806723,2020-04-27,Avalon Beach New South Wales AUSTRALIA,Avalon Beach,New South Wales,AUSTRALIA,-33.6302836,151.3297698
46,2020-04-27|Avalon Beach near Mandurah 50 miles south of Perth Western Australia AUSTRALIA,-0.12031115435350535,-0.20606047089623414,-0.16318581262486975,2020-04-27,Avalon Beach near Mandurah 50 miles south of Perth Western Australia AUSTRALIA,Avalon Beach,Western Australia,AUSTRALIA,-32.5933864,115.6364088
47,2020-04-27|Avalon New South Wales AUSTRALIA,-0.37775956393728005,-0.5311679566788544,-0.45446376030806723,2020-04-27,Avalon New South Wales AUSTRALIA,Avalon,New South Wales,AUSTRALIA,-33.6302836,151.3297698
48,2020-04-27|Avalon Point Manurah Western Australia AUSTRALIA,-0.12053510178671356,-0.2063749818047715,-0.16345504179574255,2020-04-27,Avalon Point Manurah Western Australia AUSTRALIA,Avalon Point,Western Australia,AUSTRALIA,-32.5947053,115.6329821
49,2020-04-27|Avoca Beach New South Wales AUSTRALIA,-0.38367904074607956,-0.5317987600601202,-0.45773890040309984,2020-04-27,Avoca Beach New South Wales AUSTRALIA,Avoca Beach,New South Wales,AUSTRALIA,-33.465,151.435
50,2020-04-27|Backbeach Halls Head Western Australia AUSTRALIA,-0.12208982174119389,-0.2060461950206143,-0.1640680083809041,2020-04-27,Backbeach Halls Head Western Australia AUSTRALIA,Backbeach,Western Australia,AUSTRALIA,-32.5293276,115.6941929
51,2020-04-27|Badger Head Tasmania AUSTRALIA,-0.8865447712540229,-1.3154181444759185,-1.1009814578649708,2020-04-27,Badger Head Tasmania AUSTRALIA,Badger Head,Tasmania,AUSTRALIA,-41.1291591,146.731436
52,2020-04-27|Bald Island Western Australia AUSTRALIA,-0.17342923733299453,-0.18358766343508742,-0.17850845038404098,2020-04-27,Bald Island Western Australia AUSTRALIA,Bald Island,Western Australia,AUSTRALIA,-34.9233188,118.46887759999998
53,2020-04-27|Balmain Sydney Estuary New South Wales AUSTRALIA,-0.3729549192866717,-0.5287400255451896,-0.45084747241593065,2020-04-27,Balmain Sydney Estuary New South Wales AUSTRALIA,Balmain,New South Wales,AUSTRALIA,-33.85895,151.17906000000002
54,2020-04-27|Bantry Bay near Ironstone Point Middle Harbor Sydney New South Wales AUSTRALIA,-0.3745259928563172,-0.528720405804526,-0.4516231993304216,2020-04-27,Bantry Bay near Ironstone Point Middle Harbor Sydney New South Wales AUSTRALIA,Bantry Bay,New South Wales,AUSTRALIA,-33.7806576,151.2151164
55,2020-04-27|Bar Beach Newcastle New South Wales AUSTRALIA,-0.39898988621779424,-0.5341853773299828,-0.4665876317738885,2020-04-27,Bar Beach Newcastle New South Wales AUSTRALIA,Bar Beach,New South Wales,AUSTRALIA,-32.94,151.767778
56,2020-04-27|Bargara Queensland AUSTRALIA,-0.6958878721249048,-0.8266349774865609,-0.7612614248057328,2020-04-27,Bargara Queensland AUSTRALIA,Bargara,Queensland,AUSTRALIA,-24.8312314,152.4592208
57,2020-04-27|Barren Joey Island Tasmania AUSTRALIA,-0.8543581246752586,-1.2883034724082112,-1.0713307985417349,2020-04-27,Barren Joey Island Tasmania AUSTRALIA,Barren Joey Island,Tasmania,AUSTRALIA,-40.94228579999999,146.98485580000002
58,2020-04-27|Barrier Reef Queensland AUSTRALIA,-0.06501446267859652,-0.5878482485317523,-0.32643135560517444,2020-04-27,Barrier Reef Queensland AUSTRALIA,Barrier Reef,Queensland,AUSTRALIA,-18.2870668,147.6991918
59,2020-04-27|Barrier Reef off Mackay Queensland AUSTRALIA,-1.3405142857925576,-1.3830026245664835,-1.3617584551795205,2020-04-27,Barrier Reef off Mackay Queensland AUSTRALIA,Barrier Reef off Mackay,Queensland,AUSTRALIA,-21.1424956,149.1821469
60,2020-04-27|Barrow Passage Western Australia AUSTRALIA,-0.6107425084892036,-0.9655641620428945,-0.788153335266049,2020-04-27,Barrow Passage Western Australia AUSTRALIA,Barrow Passage,Western Australia,AUSTRALIA,-20.780434200000002,115.4022706
61,2020-04-27|Barrow Point 100 miles north of Cooktown Queensland Queensland AUSTRALIA,-0.023895281701000363,-0.560700120540472,-0.2922977011207362,2020-04-27,Barrow Point 100 miles north of Cooktown Queensland Queensland AUSTRALIA,Barrow Point,Queensland,AUSTRALIA,-15.4758164,145.2470981
62,2020-04-27|Bass Point New South Wales AUSTRALIA,-0.3548550713880233,-0.5279517034702531,-0.4414033874291382,2020-04-27,Bass Point New South Wales AUSTRALIA,Bass Point,New South Wales,AUSTRALIA,-34.5959607,150.9018394
63,2020-04-27|Batemans Bay New South Wales AUSTRALIA,-0.3238480295938842,-0.5240673938322198,-0.42395771171305197,2020-04-27,Batemans Bay New South Wales AUSTRALIA,Bateman's Bay,New South Wales,AUSTRALIA,-35.7143871,150.1794707
64,2020-04-27|Bathurst Reef Rottnest Island Western Australia AUSTRALIA,-0.11557601912605465,-0.20327780373939744,-0.15942691143272605,2020-04-27,Bathurst Reef Rottnest Island Western Australia AUSTRALIA,Bathurst Reef,Western Australia,AUSTRALIA,-31.989356899999997,115.5407453
65,2020-04-27|Batt Reef Queensland AUSTRALIA,-0.04346767484500206,-0.583910729200098,-0.31368920202255,2020-04-27,Batt Reef Queensland AUSTRALIA,Batt Reef,Queensland,AUSTRALIA,-16.415952800000003,145.7710071
66,2020-04-27|Beechford Tasmania AUSTRALIA,-0.8696989519449568,-1.3018981294189906,-1.0857985406819737,2020-04-27,Beechford Tasmania AUSTRALIA,Beechford,Tasmania,AUSTRALIA,-41.042725299999994,146.9720846
67,2020-04-27|Beecroft Head New South Wales AUSTRALIA,-0.34646888186508645,-0.5258889408606757,-0.4361789113628811,2020-04-27,Beecroft Head New South Wales AUSTRALIA,Beecroft Head,New South Wales,AUSTRALIA,-35.0135426,150.84937340000002
68,2020-04-27|Belfast now Port Fairy South Australia AUSTRALIA,-0.08486957840802888,-0.4509784578599751,-0.26792401813400196,2020-04-27,Belfast now Port Fairy South Australia AUSTRALIA,Belfast (now Port Fairy),South Australia,AUSTRALIA,-38.3860016,142.2356621
69,2020-04-27|Bellambi New South Wales AUSTRALIA,-0.36161958215172624,-0.5276915951725227,-0.4446555886621245,2020-04-27,Bellambi New South Wales AUSTRALIA,Bellambi,New South Wales,AUSTRALIA,-34.366667,150.916667
70,2020-04-27|Bellambi Reef New South Wales AUSTRALIA,-0.36161958215172624,-0.5276915951725227,-0.4446555886621245,2020-04-27,Bellambi Reef New South Wales AUSTRALIA,Bellambi Reef,New South Wales,AUSTRALIA,-34.373611100000005,150.93472219999998
71,2020-04-27|Bellingen New South Wales AUSTRALIA,-0.4665389374702018,-0.5053057304533077,-0.48592233396175477,2020-04-27,Bellingen New South Wales AUSTRALIA,Bellingen,New South Wales,AUSTRALIA,-30.4522423,152.8979566
72,2020-04-27|Bellinger Head New South Wales AUSTRALIA,-0.4665389374702018,-0.5053057304533077,-0.48592233396175477,2020-04-27,Bellinger Head New South Wales AUSTRALIA,Bellinger Head,New South Wales,AUSTRALIA,-30.502025699999997,153.02505980000004
73,2020-04-27|Bells Beach Victoria AUSTRALIA,-0.6032717345306937,-1.0677419205449679,-0.8355068275378308,2020-04-27,Bells Beach Victoria AUSTRALIA,Bells Beach,Victoria,AUSTRALIA,-38.366944000000004,144.284722
74,2020-04-27|Bellynahinch on the Manning River New South Wales AUSTRALIA,-0.4300319931200997,-0.5262793179067046,-0.4781556555134021,2020-04-27,Bellynahinch on the Manning River New South Wales AUSTRALIA,"""Bellynahinch"" on the Manning River",New South Wales,AUSTRALIA,-31.8518472,152.10067469999998
75,2020-04-27|Belongil Bay New South Wales AUSTRALIA,-0.47582469689344303,-0.5063280172619179,-0.4910763570776805,2020-04-27,Belongil Bay New South Wales AUSTRALIA,Belongil Bay,New South Wales,AUSTRALIA,-28.633732799999997,153.6003455
76,2020-04-27|Belongil Beach Byron Bay New South Wales AUSTRALIA,-0.47582469689344303,-0.5063280172619179,-0.4910763570776805,2020-04-27,Belongil Beach Byron Bay New South Wales AUSTRALIA,Belongil Beach,New South Wales,AUSTRALIA,-28.633732799999997,153.6003455
77,2020-04-27|Bermagui New South Wales AUSTRALIA,-0.3122085311569501,-0.5187681841266137,-0.41548835764178194,2020-04-27,Bermagui New South Wales AUSTRALIA,Bermagui,New South Wales,AUSTRALIA,-36.4433701,150.061362
78,2020-04-27|Bernier Island Shark Bay Western Australia AUSTRALIA,-0.13112748595169652,-0.4716847875445482,-0.30140613674812233,2020-04-27,Bernier Island Shark Bay Western Australia AUSTRALIA,Bernier Island,Western Australia,AUSTRALIA,-24.8504267,113.1381998
79,2020-04-27|Berrys Bay Sydney Harbour New South Wales AUSTRALIA,-0.3729549192866717,-0.5287400255451896,-0.45084747241593065,2020-04-27,Berrys Bay Sydney Harbour New South Wales AUSTRALIA,Berry's Bay,New South Wales,AUSTRALIA,-33.8462182,151.2488616
80,2020-04-27|Between Bay Rock & Magnetic Island Cleveland Bay Queensland AUSTRALIA,-0.1488552906615489,-0.676950774584593,-0.41290303262307093,2020-04-27,Between Bay Rock & Magnetic Island Cleveland Bay Queensland AUSTRALIA,Between Bay Rock & Magnetic Island,Queensland,AUSTRALIA,-19.2180556,146.9222222
81,2020-04-27|Between Carnac and Garden Islands Western Australia AUSTRALIA,-0.11981208341430613,-0.20219333559172684,-0.16100270950301648,2020-04-27,Between Carnac and Garden Islands Western Australia AUSTRALIA,Between Carnac and Garden Islands,Western Australia,AUSTRALIA,-32.204325399999995,115.67762739999999
82,2020-04-27|Between De Grey River and Port Walcott Western Australia AUSTRALIA,-2.4782387047478944,-2.815172427353452,-2.6467055660506733,2020-04-27,Between De Grey River and Port Walcott Western Australia AUSTRALIA,Between De Grey River and Port Walcott,Western Australia,AUSTRALIA,-20.342612,118.6718706
83,2020-04-27|Between Dee Why and Long Reef New South Wales AUSTRALIA,-0.3745259928563172,-0.528720405804526,-0.4516231993304216,2020-04-27,Between Dee Why and Long Reef New South Wales AUSTRALIA,Between Dee Why and Long Reef,New South Wales,AUSTRALIA,-33.746083399999996,151.30407160000001
84,2020-04-27|Between Port Arthur Penal Colony & Forestier Peninsula Tasmania AUSTRALIA,0.04250491473092131,-0.4085032804268868,-0.18299918284798272,2020-04-27,Between Port Arthur Penal Colony & Forestier Peninsula Tasmania AUSTRALIA,Between Port Arthur Penal Colony & Forestier Peninsula,Tasmania,AUSTRALIA,-43.177459999999996,147.8420491
85,2020-04-27|Between Queensland AUSTRALIA,-1.0335381465370435,-1.0335381465370435,-1.0335381465370435,2020-04-27,Between Queensland AUSTRALIA,Between,Queensland,AUSTRALIA,-20.9175738,142.7027956
86,2020-04-27|Between Smith’s Rock & Moreton Island Queensland AUSTRALIA,-0.6197665773706634,-0.7138903656203346,-0.6668284714954991,2020-04-27,Between Smith’s Rock & Moreton Island Queensland AUSTRALIA,Between Smith’s Rock & Moreton Island,Queensland,AUSTRALIA,-27.178901,153.3730896
87,2020-04-27|Between Wynnum & St Helena Island Queensland AUSTRALIA,-0.6992755319591324,-0.7771741873698718,-0.738224859664502,2020-04-27,Between Wynnum & St Helena Island Queensland AUSTRALIA,Between Wynnum & St. Helena Island,Queensland,AUSTRALIA,-27.391666700000002,153.2327778
88,2020-04-27|Bherwerre Beach New South Wales AUSTRALIA,-0.33528293794853437,-0.5258977988695557,-0.430590368409045,2020-04-27,Bherwerre Beach New South Wales AUSTRALIA,Bherwerre Beach,New South Wales,AUSTRALIA,-35.163734600000005,150.6497392
89,2020-04-27|Bilgola Beach Sydney New South Wales AUSTRALIA,-0.37775956393728005,-0.5311679566788544,-0.45446376030806723,2020-04-27,Bilgola Beach Sydney New South Wales AUSTRALIA,Bilgola Beach,New South Wales,AUSTRALIA,-33.6444858,151.3275826
90,2020-04-27|Binalong Bay Tasmania AUSTRALIA,-0.1651777976612255,-0.47911785849761324,-0.3221478280794194,2020-04-27,Binalong Bay Tasmania AUSTRALIA,Binalong Bay,Tasmania,AUSTRALIA,-41.249126399999994,148.2928957
91,2020-04-27|Binningup Western Australia AUSTRALIA,-0.1285091975177915,-0.22651290857325623,-0.17751105304552386,2020-04-27,Binningup Western Australia AUSTRALIA,Binningup,Western Australia,AUSTRALIA,-33.135769399999994,115.72061599999999
92,2020-04-27|Birubi Point New South Wales AUSTRALIA,-0.40250639117857484,-0.532834635409975,-0.4676705132942749,2020-04-27,Birubi Point New South Wales AUSTRALIA,Birubi Point,New South Wales,AUSTRALIA,-32.7884091,152.08031430000003
93,2020-04-27|Black Head south of Taree New South Wales AUSTRALIA,-0.4300319931200997,-0.5262793179067046,-0.4781556555134021,2020-04-27,Black Head south of Taree New South Wales AUSTRALIA,Black Head,New South Wales,AUSTRALIA,-31.8894897,152.4444453
94,2020-04-27|Black Point Eyre Peninsula South Australia AUSTRALIA,-1.0401591173462381,-1.0401591173462381,-1.0401591173462381,2020-04-27,Black Point Eyre Peninsula South Australia AUSTRALIA,Black Point,South Australia,AUSTRALIA,-34.6106775,137.8773175
95,2020-04-27|Black Point South Australia AUSTRALIA,-1.0401591173462381,-1.0401591173462381,-1.0401591173462381,2020-04-27,Black Point South Australia AUSTRALIA,Black Point,South Australia,AUSTRALIA,-34.6106775,137.8773175
96,2020-04-27|Black’s Beach 9 miles north of Mackay Queensland AUSTRALIA,-1.2863811577732718,-1.3360446277054874,-1.3112128927393796,2020-04-27,Black’s Beach 9 miles north of Mackay Queensland AUSTRALIA,Black’s Beach,Queensland,AUSTRALIA,-21.062778,149.1875
97,2020-04-27|Blairgowrie Victoria AUSTRALIA,-0.6287627847013983,-1.1029570019951773,-0.8658598933482878,2020-04-27,Blairgowrie Victoria AUSTRALIA,Blairgowrie,Victoria,AUSTRALIA,-38.36,144.769
98,2020-04-27|Blue Bay New South Wales AUSTRALIA,-0.38639916337617614,-0.5322839075330041,-0.4593415354545901,2020-04-27,Blue Bay New South Wales AUSTRALIA,Blue Bay,New South Wales,AUSTRALIA,-33.353,151.501
99,2020-04-27|Boarding School Bay Victoria AUSTRALIA,-0.055423424292433104,-0.3909954054318373,-0.2232094148621352,2020-04-27,Boarding School Bay Victoria AUSTRALIA,Boarding School Bay,Victoria,AUSTRALIA,-37.471307700000004,144.7851531
100,2020-04-27|Boat Harbour north of Cronulla New South Wales AUSTRALIA,-0.4041139353069736,-0.5319665287918338,-0.4680402320494037,2020-04-27,Boat Harbour north of Cronulla New South Wales AUSTRALIA,Boat Harbour,New South Wales,AUSTRALIA,-32.7844827,152.110421
101,2020-04-27|Bombo Beach New South Wales AUSTRALIA,-0.3548550713880233,-0.5279517034702531,-0.4414033874291382,2020-04-27,Bombo Beach New South Wales AUSTRALIA,Bombo Beach,New South Wales,AUSTRALIA,-34.656041200000004,150.8556659
