,date_beach_address,height_low_tide_max,height_low_tide_min,height_low_tide_mean,date,beach_address,beach_name,country_state,country,latitude,longitude
633,2020-04-27|Off Tower Hill Victoria AUSTRALIA,-0.08512104703404172,-0.4548383591282579,-0.2699797030811498,2020-04-27,Off Tower Hill Victoria AUSTRALIA,Off Tower Hill,Victoria,AUSTRALIA,-38.3332266,142.3537074
634,2020-04-27|Off Wedge Island Western Australia AUSTRALIA,-0.21222202208992325,-0.21222202208992325,-0.21222202208992325,2020-04-27,Off Wedge Island Western Australia AUSTRALIA,Off Wedge Island,Western Australia,AUSTRALIA,-30.8277891,115.1879896
635,2020-04-27|Off Wynnum in Moreton Bay near Brisbane Queensland AUSTRALIA,-0.7247982686019732,-0.7827865426418199,-0.7537924056218965,2020-04-27,Off Wynnum in Moreton Bay near Brisbane Queensland AUSTRALIA,Off Wynnum in Moreton Bay,Queensland,AUSTRALIA,-27.443694,153.173618
636,2020-04-27|On board the Japanese longline trawler Fukuya No38 100 nm northeast of Brisbane Queensland AUSTRALIA,-0.7247982686019732,-0.7827865426418199,-0.7537924056218965,2020-04-27,On board the Japanese longline trawler Fukuya No38 100 nm northeast of Brisbane Queensland AUSTRALIA,On board the Japanese longline trawler Fukuya No.38,Queensland,AUSTRALIA,-27.469770699999998,153.0251235
637,2020-04-27|Onslow Western Australia AUSTRALIA,-0.5694253808324344,-0.9087685553534992,-0.7390969680929669,2020-04-27,Onslow Western Australia AUSTRALIA,Onslow,Western Australia,AUSTRALIA,-21.662723,115.1069826
638,2020-04-27|Opal Reef Queensland AUSTRALIA,-0.030541299064264595,-0.5601963673538543,-0.29536883320905943,2020-04-27,Opal Reef Queensland AUSTRALIA,Opal Reef,Queensland,AUSTRALIA,-16.2104561,145.881327
639,2020-04-27|Orpheus Island Queensland AUSTRALIA,-0.13912988599659096,-0.6589363016226313,-0.3990330938096111,2020-04-27,Orpheus Island Queensland AUSTRALIA,Orpheus Island,Queensland,AUSTRALIA,-18.6160685,146.49719950000002
640,2020-04-27|Otford New South Wales AUSTRALIA,-0.36414559869064955,-0.5273353888618482,-0.44574049377624886,2020-04-27,Otford New South Wales AUSTRALIA,Otford,New South Wales,AUSTRALIA,-34.216667,151.0
641,2020-04-27|Outer Barrier Reef near Port Douglas Queensland AUSTRALIA,-0.037075715971161514,-0.5867494577519777,-0.31191258686156964,2020-04-27,Outer Barrier Reef near Port Douglas Queensland AUSTRALIA,Outer Barrier Reef near Port Douglas,Queensland,AUSTRALIA,-16.4844197,145.46060580000002
642,2020-04-27|Outer Harbor South Australia AUSTRALIA,-0.9472164917521733,-1.1716641819600577,-1.0594403368561154,2020-04-27,Outer Harbor South Australia AUSTRALIA,Outer Harbor,South Australia,AUSTRALIA,-34.781,138.501
643,2020-04-27|Palm Beach New South Wales AUSTRALIA,-0.37775956393728005,-0.5311679566788544,-0.45446376030806723,2020-04-27,Palm Beach New South Wales AUSTRALIA,Palm Beach,New South Wales,AUSTRALIA,-33.601110999999996,151.321667
644,2020-04-27|Palm Beach North 5 miles north of Burleigh Heads Brisbane Queensland AUSTRALIA,-0.33258908585683156,-0.4199106482169055,-0.3762498670368685,2020-04-27,Palm Beach North 5 miles north of Burleigh Heads Brisbane Queensland AUSTRALIA,Palm Beach North,Queensland,AUSTRALIA,26.7056206,-80.0364297
645,2020-04-27|Palm Beach Queensland AUSTRALIA,-0.46637292868434194,-0.5116961985521598,-0.4890345636182508,2020-04-27,Palm Beach Queensland AUSTRALIA,Palm Beach,Queensland,AUSTRALIA,-28.122260600000004,153.4694515
646,2020-04-27|Palm Cove Beach Queensland AUSTRALIA,-0.03270143300807515,-0.5835702166106814,-0.3081358248093783,2020-04-27,Palm Cove Beach Queensland AUSTRALIA,Palm Cove Beach,Queensland,AUSTRALIA,-16.744428,145.67113590000002
647,2020-04-27|Palm Cove Queensland AUSTRALIA,-0.03270143300807515,-0.5835702166106814,-0.3081358248093783,2020-04-27,Palm Cove Queensland AUSTRALIA,Palm Cove,Queensland,AUSTRALIA,-16.74405,145.67095
648,2020-04-27|Palm Island Queensland AUSTRALIA,-0.14273735593777673,-0.6638471167980224,-0.40329223636789957,2020-04-27,Palm Island Queensland AUSTRALIA,Palm Island,Queensland,AUSTRALIA,-18.6894285,146.5392256
649,2020-04-27|Pancake Creek Queensland AUSTRALIA,-1.0335381465370435,-1.0335381465370435,-1.0335381465370435,2020-04-27,Pancake Creek Queensland AUSTRALIA,Pancake Creek,Queensland,AUSTRALIA,-20.9175738,142.7027956
650,2020-04-27|Paradise Beach Victoria AUSTRALIA,-0.30737863420109435,-0.30737863420109435,-0.30737863420109435,2020-04-27,Paradise Beach Victoria AUSTRALIA,Paradise Beach,Victoria,AUSTRALIA,-38.1992076,147.4033451
651,2020-04-27|Paramatta River New South Wales AUSTRALIA,-0.3745259928563172,-0.528720405804526,-0.4516231993304216,2020-04-27,Paramatta River New South Wales AUSTRALIA,Paramatta River,New South Wales,AUSTRALIA,-33.834442700000004,151.0923358
652,2020-04-27|Paramatta River near Sydney New South Wales AUSTRALIA,-0.3745259928563172,-0.528720405804526,-0.4516231993304216,2020-04-27,Paramatta River near Sydney New South Wales AUSTRALIA,Paramatta River (near Sydney),New South Wales,AUSTRALIA,-33.834442700000004,151.0923358
653,2020-04-27|Park Beach Coffs Harbour New South Wales AUSTRALIA,-0.46668269841823773,-0.5035781733046444,-0.48513043586144106,2020-04-27,Park Beach Coffs Harbour New South Wales AUSTRALIA,Park Beach,New South Wales,AUSTRALIA,-30.289625899999997,153.11855480000003
654,2020-04-27|Parkers Point Rottnest Island Western Australia AUSTRALIA,-0.20342640804870776,-0.20342640804870776,-0.20342640804870776,2020-04-27,Parkers Point Rottnest Island Western Australia AUSTRALIA,Parker's Point,Western Australia,AUSTRALIA,-32.014821000000005,115.53120159999999
655,2020-04-27|Parramata River New South Wales AUSTRALIA,-0.3745259928563172,-0.528720405804526,-0.4516231993304216,2020-04-27,Parramata River New South Wales AUSTRALIA,Parramata River,New South Wales,AUSTRALIA,-33.834442700000004,151.0923358
656,2020-04-27|Parramatta River New South Wales AUSTRALIA,-0.3745259928563172,-0.528720405804526,-0.4516231993304216,2020-04-27,Parramatta River New South Wales AUSTRALIA,Parramatta River,New South Wales,AUSTRALIA,-33.834442700000004,151.0923358
657,2020-04-27|Parsons Beach Fleurieu Peninsula South Australia AUSTRALIA,-0.12365804969183727,-0.37640403093116775,-0.25003104031150253,2020-04-27,Parsons Beach Fleurieu Peninsula South Australia AUSTRALIA,Parsons Beach,South Australia,AUSTRALIA,-35.630574200000005,138.4671696
658,2020-04-27|Peacock Point Balmain Sydney New South Wales AUSTRALIA,-0.3729549192866717,-0.5287400255451896,-0.45084747241593065,2020-04-27,Peacock Point Balmain Sydney New South Wales AUSTRALIA,Peacock Point,New South Wales,AUSTRALIA,-33.859680299999994,151.1964189
659,2020-04-27|Peel Island Queensland AUSTRALIA,-0.7666094861756134,-0.8123084987614706,-0.789458992468542,2020-04-27,Peel Island Queensland AUSTRALIA,Peel Island,Queensland,AUSTRALIA,-27.500573499999998,153.34761269999998
660,2020-04-27|Pelican Banks near Gladstone Queensland AUSTRALIA,-0.8627838099324384,-0.9708660522987035,-0.916824931115571,2020-04-27,Pelican Banks near Gladstone Queensland AUSTRALIA,Pelican Banks near Gladstone,Queensland,AUSTRALIA,-23.783333300000002,151.3
661,2020-04-27|Pelican Island Macleay River New South Wales AUSTRALIA,-0.4614326324623557,-0.5066146266926477,-0.48402362957750167,2020-04-27,Pelican Island Macleay River New South Wales AUSTRALIA,Pelican Island,New South Wales,AUSTRALIA,-30.9314059,153.0331545
662,2020-04-27|Pelican Waters Caloundra Queensland AUSTRALIA,-0.4476592640265638,-0.5570391125003615,-0.5023491882634626,2020-04-27,Pelican Waters Caloundra Queensland AUSTRALIA,Pelican Waters,Queensland,AUSTRALIA,-26.799,153.13299999999998
663,2020-04-27|Pennington Bay Kangaroo Island South Australia AUSTRALIA,-0.20847951710228854,-0.4546489122537014,-0.33156421467799496,2020-04-27,Pennington Bay Kangaroo Island South Australia AUSTRALIA,Pennington Bay,South Australia,AUSTRALIA,-35.8479736,137.75086090000002
664,2020-04-27|Peregian Queensland AUSTRALIA,-0.4406776595524145,-0.5528164352884186,-0.49674704742041653,2020-04-27,Peregian Queensland AUSTRALIA,Peregian,Queensland,AUSTRALIA,-26.480556,153.09555600000002
665,2020-04-27|Perth Western Australia AUSTRALIA,-0.11847753356002051,-0.20362994408238652,-0.16105373882120352,2020-04-27,Perth Western Australia AUSTRALIA,Perth,Western Australia,AUSTRALIA,-31.950526899999996,115.8604572
666,2020-04-27|Perth? Margaret River District Western Australia AUSTRALIA,-0.22980687679632028,-0.22980687679632028,-0.22980687679632028,2020-04-27,Perth? Margaret River District Western Australia AUSTRALIA,Perth? (Margaret River District),Western Australia,AUSTRALIA,-33.9610465,115.0767388
667,2020-04-27|Petersons Beach Sarina Queensland AUSTRALIA,-1.4681463973612359,-1.4879162582907346,-1.4780313278259851,2020-04-27,Petersons Beach Sarina Queensland AUSTRALIA,Peterson's Beach,Queensland,AUSTRALIA,-21.4137717,149.2243901
668,2020-04-27|Petrie Bight Brisbane River Queensland AUSTRALIA,-0.7247982686019732,-0.7827865426418199,-0.7537924056218965,2020-04-27,Petrie Bight Brisbane River Queensland AUSTRALIA,Petrie Bight,Queensland,AUSTRALIA,-27.466237800000002,153.0336145
669,2020-04-27|Phillip Island Victoria AUSTRALIA,-0.39535124247039494,-0.8351850381286862,-0.6152681402995406,2020-04-27,Phillip Island Victoria AUSTRALIA,Phillip Island,Victoria,AUSTRALIA,-38.4898703,145.20382780000003
670,2020-04-27|Pialba Beach near Maryborough Queensland AUSTRALIA,-0.839734414479291,-0.9600886180239979,-0.8999115162516444,2020-04-27,Pialba Beach near Maryborough Queensland AUSTRALIA,Pialba Beach near Maryborough,Queensland,AUSTRALIA,-25.2782552,152.8379759
671,2020-04-27|Pialba Hervey Bay Queensland AUSTRALIA,-0.839734414479291,-0.9600886180239979,-0.8999115162516444,2020-04-27,Pialba Hervey Bay Queensland AUSTRALIA,Pialba,Queensland,AUSTRALIA,-25.281299800000003,152.8294091
672,2020-04-27|Piccaninny Point 10 miles from Bicheno Tasmania AUSTRALIA,-0.1143627817715669,-0.45864702196382745,-0.28650490186769717,2020-04-27,Piccaninny Point 10 miles from Bicheno Tasmania AUSTRALIA,Piccaninny Point,Tasmania,AUSTRALIA,-41.8522419,148.25966830000002
673,2020-04-27|Pimpana River Queensland AUSTRALIA,-0.453011232781355,-0.5178727259229032,-0.4854419793521291,2020-04-27,Pimpana River Queensland AUSTRALIA,Pimpana River,Queensland,AUSTRALIA,-27.8203377,153.38490019999998
674,2020-04-27|Pincushion north of Maroochydore Beach Queensland AUSTRALIA,-0.44205138214044337,-0.5530159056621018,-0.4975336439012726,2020-04-27,Pincushion north of Maroochydore Beach Queensland AUSTRALIA,Pincushion,Queensland,AUSTRALIA,-26.6476538,153.1031686
675,2020-04-27|Pioneer River near Mackay Queensland AUSTRALIA,-1.1718833653801244,-1.2303816824152047,-1.2011325238976647,2020-04-27,Pioneer River near Mackay Queensland AUSTRALIA,Pioneer River near Mackay,Queensland,AUSTRALIA,-21.1455879,148.9558418
676,2020-04-27|Point Casuarina Bunbury Western Australia AUSTRALIA,-0.1305664232737852,-0.2304169746413153,-0.18049169895755024,2020-04-27,Point Casuarina Bunbury Western Australia AUSTRALIA,Point Casuarina,Western Australia,AUSTRALIA,-33.3153009,115.63711090000001
677,2020-04-27|Point Cook Port Phillip Bay Victoria AUSTRALIA,-0.055423424292433104,-0.3909954054318373,-0.2232094148621352,2020-04-27,Point Cook Port Phillip Bay Victoria AUSTRALIA,Point Cook,Victoria,AUSTRALIA,-37.9178086,144.7477259
678,2020-04-27|Point Henry Victoria AUSTRALIA,-0.07610293784790392,-0.39804938412130514,-0.23707616098460454,2020-04-27,Point Henry Victoria AUSTRALIA,Point Henry,Victoria,AUSTRALIA,-38.1468463,144.4301958
679,2020-04-27|Point Lonsdale Victoria AUSTRALIA,-0.6199473295205045,-1.097840271822532,-0.8588938006715182,2020-04-27,Point Lonsdale Victoria AUSTRALIA,Point Lonsdale,Victoria,AUSTRALIA,-38.283333,144.6
680,2020-04-27|Point Lookout Stradbroke Island Queensland AUSTRALIA,-0.43670446178896133,-0.528947676708748,-0.48282606924885463,2020-04-27,Point Lookout Stradbroke Island Queensland AUSTRALIA,Point Lookout,Queensland,AUSTRALIA,-27.434650800000004,153.5304523
681,2020-04-27|Point Lowly north of Whyalla South Australia AUSTRALIA,-0.6364518951318139,-1.2320483788232337,-0.9342501369775238,2020-04-27,Point Lowly north of Whyalla South Australia AUSTRALIA,Point Lowly,South Australia,AUSTRALIA,-32.999444,137.785278
682,2020-04-27|Point Plomer New South Wales AUSTRALIA,-0.4529547339277275,-0.5111648509578706,-0.48205979244279906,2020-04-27,Point Plomer New South Wales AUSTRALIA,Point Plomer,New South Wales,AUSTRALIA,-31.315232,152.97704109999998
683,2020-04-27|Point Sinclair Cactus Beach near Penong South Australia AUSTRALIA,-0.40226880811067667,-0.6392615547425953,-0.520765181426636,2020-04-27,Point Sinclair Cactus Beach near Penong South Australia AUSTRALIA,Point Sinclair,South Australia,AUSTRALIA,-32.0102589,132.98821940000002
684,2020-04-27|Point Sinclair Penong South Australia AUSTRALIA,-0.402937938142251,-0.6400127075547785,-0.5214753228485147,2020-04-27,Point Sinclair Penong South Australia AUSTRALIA,(Point Sinclair) Penong,South Australia,AUSTRALIA,-32.106519899999995,132.97958
685,2020-04-27|Point Vernon Hervey Bay Queensland AUSTRALIA,-0.839734414479291,-0.9600886180239979,-0.8999115162516444,2020-04-27,Point Vernon Hervey Bay Queensland AUSTRALIA,Point Vernon,Queensland,AUSTRALIA,-25.257124100000002,152.8176466
686,2020-04-27|Porpoise Pool Tweed Heads New South Wales AUSTRALIA,-0.46777007377317753,-0.510006431290932,-0.4888882525320548,2020-04-27,Porpoise Pool Tweed Heads New South Wales AUSTRALIA,Porpoise Pool,New South Wales,AUSTRALIA,-28.170037,153.543026
687,2020-04-27|Port Augusta South Australia AUSTRALIA,-0.7322238098996007,-1.4245764133694783,-1.0784001116345394,2020-04-27,Port Augusta South Australia AUSTRALIA,Port Augusta,South Australia,AUSTRALIA,-32.495233899999995,137.78943940000002
688,2020-04-27|Port Campbell Victoria AUSTRALIA,-0.12494580625072582,-0.5083741116686326,-0.3166599589596792,2020-04-27,Port Campbell Victoria AUSTRALIA,Port Campbell,Victoria,AUSTRALIA,-38.6191008,142.9961352
689,2020-04-27|Port Douglas Queensland AUSTRALIA,-0.037075715971161514,-0.5867494577519777,-0.31191258686156964,2020-04-27,Port Douglas Queensland AUSTRALIA,Port Douglas,Queensland,AUSTRALIA,-16.483611,145.465278
690,2020-04-27|Port Germein South Australia AUSTRALIA,-0.6434895177332804,-1.2488249085248138,-0.9461572131290471,2020-04-27,Port Germein South Australia AUSTRALIA,Port Germein,South Australia,AUSTRALIA,-33.0219965,138.0016436
691,2020-04-27|Port Hedland Western Australia AUSTRALIA,-2.2688428153102,-2.617474491264364,-2.443158653287282,2020-04-27,Port Hedland Western Australia AUSTRALIA,Port Hedland,Western Australia,AUSTRALIA,-20.3839142,118.64837959999998
692,2020-04-27|Port Hughes South Australia AUSTRALIA,-0.30560896481080807,-0.38347065594780283,-0.3445398103793055,2020-04-27,Port Hughes South Australia AUSTRALIA,Port Hughes,South Australia,AUSTRALIA,-34.076111,137.546111
693,2020-04-27|Port Jackson New South Wales AUSTRALIA,-0.3729549192866717,-0.5287400255451896,-0.45084747241593065,2020-04-27,Port Jackson New South Wales AUSTRALIA,Port Jackson,New South Wales,AUSTRALIA,-33.8462182,151.2488616
694,2020-04-27|Port Jervis New South Wales AUSTRALIA,-0.3450188455668866,-0.5258159554157867,-0.4354174004913367,2020-04-27,Port Jervis New South Wales AUSTRALIA,Port Jervis,New South Wales,AUSTRALIA,-35.0480805,150.7446771
695,2020-04-27|Port Kennedy Beach Western Australia AUSTRALIA,-0.12292478684396176,-0.20292053602019103,-0.1629226614320764,2020-04-27,Port Kennedy Beach Western Australia AUSTRALIA,Port Kennedy Beach,Western Australia,AUSTRALIA,-32.3522464,115.7422946
696,2020-04-27|Port MacDonnel Victoria AUSTRALIA,-0.09801184172045668,-0.4257674172032776,-0.2618896294618671,2020-04-27,Port MacDonnel Victoria AUSTRALIA,Port MacDonnel,Victoria,AUSTRALIA,-38.05249570000001,140.70019240000002
697,2020-04-27|Port Melbourne Victoria AUSTRALIA,-0.05599107678193013,-0.3929429686686161,-0.22446702272527314,2020-04-27,Port Melbourne Victoria AUSTRALIA,Port Melbourne,Victoria,AUSTRALIA,-37.83322329999999,144.9124697
698,2020-04-27|Port Newby South Australia AUSTRALIA,-0.7322238098996007,-1.4245764133694783,-1.0784001116345394,2020-04-27,Port Newby South Australia AUSTRALIA,Port Newby,South Australia,AUSTRALIA,-30.0002315,136.20915469999997
699,2020-04-27|Port Phillip Bay Port Melbourne Victoria AUSTRALIA,-0.6199473295205045,-1.097840271822532,-0.8588938006715182,2020-04-27,Port Phillip Bay Port Melbourne Victoria AUSTRALIA,Port Phillip Bay,Victoria,AUSTRALIA,-38.3,144.6333333
700,2020-04-27|Port Phillip Bay South Australia AUSTRALIA,-0.0578213271296302,-0.3984884963273998,-0.228154911728515,2020-04-27,Port Phillip Bay South Australia AUSTRALIA,Port Phillip Bay,South Australia,AUSTRALIA,-38.173206,144.8731219
701,2020-04-27|Port Phillip Bay Victoria AUSTRALIA,-0.0578213271296302,-0.3984884963273998,-0.228154911728515,2020-04-27,Port Phillip Bay Victoria AUSTRALIA,Port Phillip Bay,Victoria,AUSTRALIA,-38.173206,144.8731219
702,2020-04-27|Port Phillip South Australia AUSTRALIA,-0.05599107678193013,-0.3929429686686161,-0.22446702272527314,2020-04-27,Port Phillip South Australia AUSTRALIA,Port Phillip,South Australia,AUSTRALIA,-37.84649829999999,144.9666905
703,2020-04-27|Port Phillip Victoria AUSTRALIA,-0.05599107678193013,-0.3929429686686161,-0.22446702272527314,2020-04-27,Port Phillip Victoria AUSTRALIA,Port Phillip,Victoria,AUSTRALIA,-37.84649829999999,144.9666905
704,2020-04-27|Port Pirie Spencer Gulf 230 km north of Adelaide South Australia AUSTRALIA,-0.6272256480441618,-1.2227144507547376,-0.9249700493994497,2020-04-27,Port Pirie Spencer Gulf 230 km north of Adelaide South Australia AUSTRALIA,Port Pirie,South Australia,AUSTRALIA,-33.1708294,138.00885669999997
705,2020-04-27|Port River Adelaide South Australia AUSTRALIA,-0.9472164917521733,-1.1716641819600577,-1.0594403368561154,2020-04-27,Port River Adelaide South Australia AUSTRALIA,Port River,South Australia,AUSTRALIA,-34.7617799,138.51011
706,2020-04-27|Port Wakefield South Australia AUSTRALIA,-1.1753779750604807,-1.425126128482003,-1.300252051771242,2020-04-27,Port Wakefield South Australia AUSTRALIA,Port Wakefield,South Australia,AUSTRALIA,-34.183333000000005,138.15
707,2020-04-27|Portarlington Victoria AUSTRALIA,-0.06523140304191581,-0.39416140989572174,-0.22969640646881878,2020-04-27,Portarlington Victoria AUSTRALIA,Portarlington,Victoria,AUSTRALIA,-38.116667,144.65
708,2020-04-27|Portland Victoria AUSTRALIA,-0.08652286635270029,-0.43798078871851065,-0.2622518275356055,2020-04-27,Portland Victoria AUSTRALIA,Portland,Victoria,AUSTRALIA,-38.360895,141.6041155
709,2020-04-27|Portsea Beach near Melbourne Victoria AUSTRALIA,-0.42761789283436474,-0.8553139312600769,-0.6414659120472208,2020-04-27,Portsea Beach near Melbourne Victoria AUSTRALIA,Portsea Beach,Victoria,AUSTRALIA,-38.3339592,144.7019091
710,2020-04-27|Portsea Beach near entrance to Port Phillip Bay Victoria AUSTRALIA,-0.42761789283436474,-0.8553139312600769,-0.6414659120472208,2020-04-27,Portsea Beach near entrance to Port Phillip Bay Victoria AUSTRALIA,Portsea Beach,Victoria,AUSTRALIA,-38.3339592,144.7019091
711,2020-04-27|Princess Royal Harbor near King George’s Sound Western Australia AUSTRALIA,-0.17611340117249838,-0.176163145466091,-0.17613827331929469,2020-04-27,Princess Royal Harbor near King George’s Sound Western Australia AUSTRALIA,Princess Royal Harbor,Western Australia,AUSTRALIA,-35.0458333,117.9733333
712,2020-04-27|Pyramids Beach Mandurah Western Australia AUSTRALIA,-0.12053510178671356,-0.2063749818047715,-0.16345504179574255,2020-04-27,Pyramids Beach Mandurah Western Australia AUSTRALIA,Pyramids Beach,Western Australia,AUSTRALIA,-32.603604100000005,115.6304031
713,2020-04-27|Pyramids Beach Port Bouvard Western Australia AUSTRALIA,-0.12053510178671356,-0.2063749818047715,-0.16345504179574255,2020-04-27,Pyramids Beach Port Bouvard Western Australia AUSTRALIA,Pyramids Beach,Western Australia,AUSTRALIA,-32.603604100000005,115.6304031
714,2020-04-27|Pyramids Beach Western Australia AUSTRALIA,-0.12053510178671356,-0.2063749818047715,-0.16345504179574255,2020-04-27,Pyramids Beach Western Australia AUSTRALIA,Pyramids Beach,Western Australia,AUSTRALIA,-32.603604100000005,115.6304031
715,2020-04-27|Queenscliff New South Wales AUSTRALIA,-0.3745259928563172,-0.528720405804526,-0.4516231993304216,2020-04-27,Queenscliff New South Wales AUSTRALIA,Queenscliff,New South Wales,AUSTRALIA,-33.7825,151.284722
716,2020-04-27|Queenscliff Sydney New South Wales AUSTRALIA,-0.3745259928563172,-0.528720405804526,-0.4516231993304216,2020-04-27,Queenscliff Sydney New South Wales AUSTRALIA,Queenscliff,New South Wales,AUSTRALIA,-33.7825,151.284722
717,2020-04-27|Queenscliff Victoria AUSTRALIA,-0.6199473295205045,-1.097840271822532,-0.8588938006715182,2020-04-27,Queenscliff Victoria AUSTRALIA,Queenscliff,Victoria,AUSTRALIA,-38.2677746,144.6286897
718,2020-04-27|Quinn’s Rocks south of Yanchep Western Australia AUSTRALIA,-0.1158134381421452,-0.20588729428003938,-0.16085036621109228,2020-04-27,Quinn’s Rocks south of Yanchep Western Australia AUSTRALIA,Quinn’s Rocks,Western Australia,AUSTRALIA,-31.660517499999997,115.6959328
719,2020-04-27|Ralph Bay Tasmania AUSTRALIA,0.0703117548020192,-0.42885493943372205,-0.17927159231585144,2020-04-27,Ralph Bay Tasmania AUSTRALIA,Ralph Bay,Tasmania,AUSTRALIA,-42.97,147.43
720,2020-04-27|Red Bluff near Quobba Station Western Australia AUSTRALIA,-0.19147423199462585,-0.5185916866784885,-0.3550329593365572,2020-04-27,Red Bluff near Quobba Station Western Australia AUSTRALIA,Red Bluff near Quobba Station,Western Australia,AUSTRALIA,-24.05,113.4
721,2020-04-27|Red Bluffs Western Australia AUSTRALIA,-3.7025498395864482,-4.044074508635673,-3.873312174111061,2020-04-27,Red Bluffs Western Australia AUSTRALIA,Red Bluffs,Western Australia,AUSTRALIA,-18.8,126.46666670000002
722,2020-04-27|Redgate Beach Western Australia AUSTRALIA,-0.2318298994519613,-0.2318298994519613,-0.2318298994519613,2020-04-27,Redgate Beach Western Australia AUSTRALIA,Redgate Beach,Western Australia,AUSTRALIA,-34.039174700000004,114.99853700000001
723,2020-04-27|Redhead Beach New South Wales AUSTRALIA,-0.3977593080733254,-0.5336880625525215,-0.46572368531292346,2020-04-27,Redhead Beach New South Wales AUSTRALIA,Redhead Beach,New South Wales,AUSTRALIA,-33.0204805,151.70915119999998
724,2020-04-27|Redhead Beach Newcastle New South Wales AUSTRALIA,-0.3977593080733254,-0.5336880625525215,-0.46572368531292346,2020-04-27,Redhead Beach Newcastle New South Wales AUSTRALIA,Redhead Beach,New South Wales,AUSTRALIA,-33.0204805,151.70915119999998
725,2020-04-27|Rib Reef off Townsville Queensland AUSTRALIA,-0.10768423248990312,-0.6312078345111486,-0.36944603350052585,2020-04-27,Rib Reef off Townsville Queensland AUSTRALIA,Rib Reef off Townsville,Queensland,AUSTRALIA,-18.481090899999998,146.8713315
726,2020-04-27|Riecks Point Campbell’s Beach New South Wales AUSTRALIA,-0.4725580295593844,-0.5073699857446625,-0.48996400765202347,2020-04-27,Riecks Point Campbell’s Beach New South Wales AUSTRALIA,Riecks Point,New South Wales,AUSTRALIA,-30.2379185,153.15217619999999
727,2020-04-27|Roe Reef off Rottnest Island Western Australia AUSTRALIA,-0.11557601912605465,-0.20327780373939744,-0.15942691143272605,2020-04-27,Roe Reef off Rottnest Island Western Australia AUSTRALIA,Roe Reef off Rottnest Island,Western Australia,AUSTRALIA,-31.9791667,115.53333329999998
728,2020-04-27|Rosebud Victoria AUSTRALIA,-0.05836159272820475,-0.4020900542949145,-0.23022582351155962,2020-04-27,Rosebud Victoria AUSTRALIA,Rosebud,Victoria,AUSTRALIA,-38.356,144.918
729,2020-04-27|Ross Creek Queensland AUSTRALIA,-0.4361602715276993,-0.5552648094169453,-0.4957125404723223,2020-04-27,Ross Creek Queensland AUSTRALIA,Ross Creek,Queensland,AUSTRALIA,-26.0970062,152.7500251
730,2020-04-27|Ross River Townsville Queensland AUSTRALIA,-0.1396391170338417,-0.6702045445780532,-0.40492183080594746,2020-04-27,Ross River Townsville Queensland AUSTRALIA,Ross River,Queensland,AUSTRALIA,-19.4006854,146.7329811
731,2020-04-27|Rothesay Bay Queensland AUSTRALIA,-0.453011232781355,-0.5178727259229032,-0.4854419793521291,2020-04-27,Rothesay Bay Queensland AUSTRALIA,Rothesay Bay,Queensland,AUSTRALIA,-27.6733333,153.37444440000002
732,2020-04-27|Rottnest Island Western Australia AUSTRALIA,-0.20342640804870776,-0.20342640804870776,-0.20342640804870776,2020-04-27,Rottnest Island Western Australia AUSTRALIA,Rottnest Island,Western Australia,AUSTRALIA,-32.0063677,115.5073002
733,2020-04-27|Rubbish Dump Creek Mackay Queensland AUSTRALIA,-1.3405142857925576,-1.3830026245664835,-1.3617584551795205,2020-04-27,Rubbish Dump Creek Mackay Queensland AUSTRALIA,Rubbish Dump Creek,Queensland,AUSTRALIA,-21.1424956,149.1821469
734,2020-04-27|Rudder Reef Queensland AUSTRALIA,-0.036784545820219595,-0.5727543676412785,-0.30476945673074907,2020-04-27,Rudder Reef Queensland AUSTRALIA,Rudder Reef,Queensland,AUSTRALIA,-16.1906218,145.6990989
735,2020-04-27|Russel Island Frankland Group Queensland AUSTRALIA,-0.048767462230636424,-0.594434691082299,-0.3216010766564677,2020-04-27,Russel Island Frankland Group Queensland AUSTRALIA,Russel Island,Queensland,AUSTRALIA,-17.2291545,146.09400219999998
736,2020-04-27|Ryde Sydney Estuary New South Wales AUSTRALIA,-0.3745259928563172,-0.528720405804526,-0.4516231993304216,2020-04-27,Ryde Sydney Estuary New South Wales AUSTRALIA,Ryde,New South Wales,AUSTRALIA,-33.815746600000004,151.1030164
737,2020-04-27|Safety Cove Tasmania AUSTRALIA,0.033753321271454924,-0.40741478119666685,-0.18683072996260597,2020-04-27,Safety Cove Tasmania AUSTRALIA,Safety Cove,Tasmania,AUSTRALIA,-43.1625907,147.8547571
738,2020-04-27|Sailor Bay Middle Harbour Sydney New South Wales AUSTRALIA,-0.3745259928563172,-0.528720405804526,-0.4516231993304216,2020-04-27,Sailor Bay Middle Harbour Sydney New South Wales AUSTRALIA,Sailor Bay,New South Wales,AUSTRALIA,-33.8035561,151.2270015
